influencer_id,platform,date,URL,caption,reach,likes,comments
445,Twitter,2025-03-02,https://example.com/post/445/70690090,Post by Divya Iyer on Fat Burners,161101,18673,3158
215,YouTube,2022-09-13,https://example.com/post/215/28714249,Post by Neha Chatterjee on Speciality Supplements,827556,41563,3124
446,Instagram,2023-05-26,https://example.com/post/446/63609010,Post by Priya Kapoor on Gainers,384474,1878,3558
406,Twitter,2023-07-13,https://example.com/post/406/30272064,Post by Sneha Kumar on Vital Herbs,622739,24155,1777
49,Instagram,2022-08-27,https://example.com/post/49/62518275,Post by Priya Kapoor on Gainers,496230,19697,2219
173,YouTube,2023-09-03,https://example.com/post/173/12909930,Post by Sanya Chopra on Fat Burners,522480,51460,1296
156,Twitter,2024-02-13,https://example.com/post/156/40566650,Post by Sanya Chatterjee on Proteins,200172,63821,4971
371,Facebook,2025-05-12,https://example.com/post/371/68096981,Post by Priya Naidu on Vital Herbs,457243,20998,3992
497,Facebook,2022-11-24,https://example.com/post/497/57428438,Post by Deepak Bhartia on Herbs for Personal Care,112161,8819,2648
362,Twitter,2025-03-27,https://example.com/post/362/91579904,Post by Isha Mehta on Herbs for Personal Care,304375,18593,1926
266,Instagram,2025-05-02,https://example.com/post/266/39045233,Post by Rohit Das on Gainers,437569,64341,106
490,Facebook,2024-04-15,https://example.com/post/490/94759650,Post by Rahul Mehta on Multivitamins,167306,44428,2544
351,YouTube,2024-12-19,https://example.com/post/351/92091154,Post by Anjali Chopra on Vital Herbs,128766,78577,1060
272,YouTube,2024-02-22,https://example.com/post/272/55781296,Post by Anita Kapoor on Multivitamins,760962,48986,1049
190,YouTube,2025-03-20,https://example.com/post/190/18472493,Post by Ravi Mehta on Herbs for Personal Care,19570,58649,3031
214,Facebook,2023-12-11,https://example.com/post/214/38112706,Post by Ravi Joshi on Proteins,991460,42805,1912
466,Facebook,2024-04-25,https://example.com/post/466/95076782,Post by Priya Naidu on Pre/Post Workout,961220,62464,2298
285,YouTube,2024-06-21,https://example.com/post/285/87473129,Post by Sneha Joshi on Gainers,833378,43442,1592
462,Instagram,2023-04-11,https://example.com/post/462/53195660,Post by Manish Das on Speciality Supplements,820561,82976,4688
498,YouTube,2023-11-05,https://example.com/post/498/89568937,Post by Amit Kumar on Proteins,639988,31116,2040
251,Facebook,2025-03-13,https://example.com/post/251/12603460,Post by Rohit Bhartia on Multivitamins,329686,67022,783
197,Facebook,2023-05-24,https://example.com/post/197/93699114,Post by Divya Malhotra on Gainers,338279,10707,4335
252,Twitter,2025-02-26,https://example.com/post/252/90879572,Post by Priya Patel on Vital Herbs,945169,95447,2179
35,Twitter,2025-01-30,https://example.com/post/35/62288069,Post by Karan Sharma on Gainers,816197,25370,2262
365,Twitter,2023-05-14,https://example.com/post/365/58826054,Post by Aditya Mehta on Herbs for Personal Care,889954,7786,3880
127,Twitter,2023-10-25,https://example.com/post/127/94969193,Post by Ravi Reddy on Gainers,4201,42938,2917
423,Facebook,2025-04-08,https://example.com/post/423/85413975,Post by Aditya Gupta on Vital Herbs,154218,35800,2621
249,Instagram,2024-04-28,https://example.com/post/249/91170992,Post by Amit Mehta on Pre/Post Workout,927116,70345,1638
422,Twitter,2023-08-14,https://example.com/post/422/90206794,Post by Ravi Verma on Weight Loss Foods,635473,15826,2421
376,YouTube,2022-11-26,https://example.com/post/376/36164817,Post by Sneha Joshi on Weight Loss Foods,549931,66127,2313
128,Instagram,2024-09-02,https://example.com/post/128/66772934,Post by Priya Das on Herbs for Immunity,735680,1480,2442
134,Facebook,2023-09-16,https://example.com/post/134/29335352,Post by Deepak Nair on Multivitamins,311486,3363,236
334,YouTube,2024-12-04,https://example.com/post/334/20564233,Post by Vikram Chopra on Speciality Supplements,387538,60990,1209
229,YouTube,2024-09-14,https://example.com/post/229/84526321,Post by Anita Bhartia on Weight Loss Foods,165603,77886,3638
389,Twitter,2024-04-28,https://example.com/post/389/24461271,Post by Sanya Naidu on Fat Burners,983413,35905,3735
142,Twitter,2023-09-03,https://example.com/post/142/91408752,Post by Anjali Kapoor on Vital Herbs,476354,37374,1334
301,YouTube,2023-04-14,https://example.com/post/301/53325981,Post by Divya Gupta on Gainers,18779,16291,429
445,Twitter,2024-05-23,https://example.com/post/445/84165377,Post by Divya Iyer on Fat Burners,501277,48392,1161
162,Instagram,2024-08-31,https://example.com/post/162/83836812,Post by Pooja Reddy on Gainers,27702,82479,3557
331,Facebook,2024-05-18,https://example.com/post/331/63088171,Post by Manish Joshi on Herbs for Personal Care,187644,42859,282
330,Facebook,2024-02-24,https://example.com/post/330/53488444,Post by Priya Kapoor on Vital Herbs,594092,99204,4657
21,YouTube,2025-06-06,https://example.com/post/21/17497292,Post by Isha Naidu on Herbs for Immunity,758886,94064,1080
255,Facebook,2022-12-02,https://example.com/post/255/19112666,Post by Priya Gupta on Vital Herbs,147707,19916,837
268,Twitter,2023-06-24,https://example.com/post/268/41542991,Post by Aditya Chopra on Fat Burners,97321,98964,2951
498,YouTube,2024-07-25,https://example.com/post/498/55386805,Post by Amit Kumar on Proteins,86101,54135,2814
385,Twitter,2022-12-14,https://example.com/post/385/76096285,Post by Ravi Naidu on Pre/Post Workout,421017,71498,509
269,Instagram,2024-11-23,https://example.com/post/269/96143448,Post by Anjali Kumar on Weight Loss Foods,829090,51953,1269
281,Twitter,2023-01-24,https://example.com/post/281/37817237,Post by Ravi Kapoor on Herbs for Immunity,471284,20898,944
391,YouTube,2024-01-10,https://example.com/post/391/40520595,Post by Priya Sharma on Speciality Supplements,251887,7457,4568
13,Facebook,2022-11-09,https://example.com/post/13/96288920,Post by Anjali Das on Vital Herbs,884837,91444,1847
246,Twitter,2022-10-19,https://example.com/post/246/15660750,Post by Deepak Chopra on Gainers,230639,99471,1905
487,Instagram,2023-06-02,https://example.com/post/487/28478172,Post by Amit Kumar on Pre/Post Workout,525900,41922,2645
199,Twitter,2024-10-12,https://example.com/post/199/12584460,Post by Sneha Iyer on Vital Herbs,536032,38013,4032
13,Facebook,2024-11-20,https://example.com/post/13/83823922,Post by Anjali Das on Vital Herbs,72262,5309,1639
302,Facebook,2022-10-06,https://example.com/post/302/38029575,Post by Deepak Gupta on Herbs for Personal Care,241654,76430,4026
4,YouTube,2024-07-09,https://example.com/post/4/20821631,Post by Suresh Chatterjee on Pre/Post Workout,610834,48299,4170
461,Twitter,2023-06-26,https://example.com/post/461/63308797,Post by Karan Bhartia on Weight Loss Foods,224114,20006,4392
4,YouTube,2024-02-21,https://example.com/post/4/45654499,Post by Suresh Chatterjee on Pre/Post Workout,584283,49110,4185
199,Twitter,2023-06-17,https://example.com/post/199/37056403,Post by Sneha Iyer on Vital Herbs,791806,79691,2099
172,YouTube,2023-08-29,https://example.com/post/172/53896992,Post by Neha Nair on Proteins,942545,34173,3216
62,YouTube,2024-02-29,https://example.com/post/62/70619406,Post by Aditya Menon on Fat Burners,31217,58448,4942
496,YouTube,2025-06-07,https://example.com/post/496/64450900,Post by Amit Chopra on Gainers,215528,24276,923
22,Facebook,2024-09-25,https://example.com/post/22/24325007,Post by Manish Menon on Speciality Supplements,779896,26996,1639
389,Twitter,2024-03-27,https://example.com/post/389/38768553,Post by Sanya Naidu on Fat Burners,930722,77809,2485
185,Twitter,2025-02-28,https://example.com/post/185/17297089,Post by Suresh Joshi on Vital Herbs,680299,82116,1882
291,Facebook,2023-12-23,https://example.com/post/291/39099216,Post by Karan Sharma on Multivitamins,536926,3171,2538
7,Twitter,2023-10-11,https://example.com/post/7/34282556,Post by Rahul Verma on Herbs for Personal Care,903150,43819,1690
256,YouTube,2024-09-27,https://example.com/post/256/53937353,Post by Rohit Joshi on Herbs for Immunity,481126,51266,4930
386,Facebook,2023-06-28,https://example.com/post/386/75992475,Post by Rohit Chopra on Proteins,504500,73559,4888
147,YouTube,2023-12-15,https://example.com/post/147/20425244,Post by Amit Sharma on Proteins,647311,14108,2
437,Twitter,2022-09-26,https://example.com/post/437/93117917,Post by Rohit Iyer on Herbs for Personal Care,53458,1519,2246
477,Twitter,2022-07-25,https://example.com/post/477/50727906,Post by Rahul Kumar on Weight Loss Foods,467679,50043,4653
493,YouTube,2023-06-16,https://example.com/post/493/23050348,Post by Ravi Reddy on Weight Loss Foods,57138,48291,1763
331,Facebook,2023-08-19,https://example.com/post/331/66796333,Post by Manish Joshi on Herbs for Personal Care,778882,48916,623
144,Twitter,2024-11-26,https://example.com/post/144/97728193,Post by Shweta Sharma on Vital Herbs,24482,39039,286
461,Twitter,2023-03-27,https://example.com/post/461/50540480,Post by Karan Bhartia on Weight Loss Foods,149728,34485,3743
477,Twitter,2023-09-17,https://example.com/post/477/26149750,Post by Rahul Kumar on Weight Loss Foods,965067,83504,248
451,Instagram,2025-03-26,https://example.com/post/451/33431904,Post by Karan Mehta on Herbs for Immunity,16040,14806,705
372,Instagram,2023-11-17,https://example.com/post/372/71101892,Post by Priya Verma on Multivitamins,913042,76042,4566
140,Instagram,2024-01-29,https://example.com/post/140/13027810,Post by Vikram Menon on Herbs for Personal Care,738019,73873,3929
33,Facebook,2023-06-03,https://example.com/post/33/38920642,Post by Divya Reddy on Herbs for Immunity,69322,52156,3091
16,Facebook,2022-10-09,https://example.com/post/16/76763043,Post by Neha Das on Multivitamins,454496,61090,3378
90,Twitter,2022-08-21,https://example.com/post/90/87411508,Post by Manish Bhartia on Herbs for Personal Care,942000,5821,516
492,YouTube,2024-02-20,https://example.com/post/492/47791498,Post by Rahul Chatterjee on Fat Burners,754790,62855,1660
411,YouTube,2024-01-23,https://example.com/post/411/13276640,Post by Karan Malhotra on Multivitamins,704848,35696,1540
121,Instagram,2025-01-27,https://example.com/post/121/10261534,Post by Pooja Reddy on Fat Burners,682765,5833,4613
428,Twitter,2025-01-01,https://example.com/post/428/85020246,Post by Priya Sharma on Multivitamins,999397,92186,4002
406,Twitter,2023-11-11,https://example.com/post/406/16347764,Post by Sneha Kumar on Vital Herbs,301434,47764,724
307,Facebook,2024-08-15,https://example.com/post/307/71237842,Post by Anjali Das on Vital Herbs,861581,61978,4461
84,YouTube,2024-08-27,https://example.com/post/84/98395975,Post by Suresh Das on Multivitamins,946627,48713,4513
277,Twitter,2023-05-19,https://example.com/post/277/53045133,Post by Shweta Nair on Gainers,771907,83846,2840
209,Facebook,2023-07-16,https://example.com/post/209/87874708,Post by Rohit Gupta on Fat Burners,422296,48823,3829
178,Facebook,2024-03-14,https://example.com/post/178/29814990,Post by Pooja Kapoor on Gainers,854779,88216,4051
346,YouTube,2024-11-06,https://example.com/post/346/58362519,Post by Anjali Patel on Vital Herbs,453682,11380,4932
130,Instagram,2023-05-02,https://example.com/post/130/54668206,Post by Anjali Reddy on Multivitamins,970638,47061,3822
231,Facebook,2023-06-26,https://example.com/post/231/15738577,Post by Divya Joshi on Pre/Post Workout,361137,66418,1188
307,Facebook,2024-06-23,https://example.com/post/307/82505898,Post by Anjali Das on Vital Herbs,664431,97671,1306
436,Twitter,2023-05-06,https://example.com/post/436/37623724,Post by Vikram Joshi on Vital Herbs,865745,90911,3246
42,Twitter,2024-11-29,https://example.com/post/42/25016273,Post by Neha Nair on Speciality Supplements,526738,71352,343
267,Twitter,2023-02-22,https://example.com/post/267/87237550,Post by Divya Malhotra on Pre/Post Workout,5236,33436,4509
341,Instagram,2023-06-27,https://example.com/post/341/40438208,Post by Sanya Patel on Weight Loss Foods,718237,93078,2743
251,Facebook,2023-03-21,https://example.com/post/251/53686165,Post by Rohit Bhartia on Multivitamins,768405,48982,4492
480,Facebook,2024-10-10,https://example.com/post/480/80212115,Post by Sneha Sharma on Speciality Supplements,689801,51535,1794
296,Twitter,2024-07-13,https://example.com/post/296/64760624,Post by Rohit Kumar on Gainers,722211,98559,871
116,YouTube,2025-02-08,https://example.com/post/116/30897858,Post by Sanya Gupta on Herbs for Personal Care,875878,91006,1542
367,Twitter,2022-07-26,https://example.com/post/367/77714331,Post by Sneha Gupta on Vital Herbs,839792,14179,4056
74,Instagram,2022-12-19,https://example.com/post/74/51145240,Post by Anjali Chopra on Herbs for Personal Care,254580,99114,3326
156,Twitter,2023-09-26,https://example.com/post/156/82741563,Post by Sanya Chatterjee on Proteins,670252,12709,1564
13,Facebook,2022-08-27,https://example.com/post/13/14173828,Post by Anjali Das on Vital Herbs,311152,15919,1696
96,Twitter,2022-12-18,https://example.com/post/96/18995520,Post by Deepak Das on Multivitamins,266744,59373,974
217,Twitter,2024-07-26,https://example.com/post/217/98796442,Post by Anjali Chopra on Proteins,423576,1435,4895
154,Twitter,2024-06-26,https://example.com/post/154/62042563,Post by Suresh Iyer on Fat Burners,394127,27371,2488
220,Facebook,2025-03-30,https://example.com/post/220/95257731,Post by Pooja Malhotra on Speciality Supplements,645667,77819,343
348,Twitter,2025-04-26,https://example.com/post/348/14230279,Post by Priya Naidu on Weight Loss Foods,525282,41944,2879
16,Facebook,2023-12-30,https://example.com/post/16/73565178,Post by Neha Das on Multivitamins,904007,50349,4415
395,Twitter,2023-02-10,https://example.com/post/395/66734057,Post by Amit Naidu on Fat Burners,723040,77005,2875
486,Facebook,2025-04-24,https://example.com/post/486/13667919,Post by Aditya Singh on Fat Burners,399424,5118,3993
389,Twitter,2023-01-18,https://example.com/post/389/73736212,Post by Sanya Naidu on Fat Burners,265405,71318,754
43,Instagram,2023-12-09,https://example.com/post/43/94731492,Post by Deepak Mehta on Herbs for Immunity,968113,12371,3724
195,Twitter,2024-06-14,https://example.com/post/195/42397292,Post by Aditya Menon on Herbs for Immunity,633929,61559,281
166,Facebook,2024-04-19,https://example.com/post/166/84172174,Post by Ravi Chopra on Vital Herbs,815915,92329,3696
111,Twitter,2024-11-11,https://example.com/post/111/22744478,Post by Shweta Singh on Speciality Supplements,11793,89680,1051
304,Twitter,2022-09-20,https://example.com/post/304/77953702,Post by Aditya Kumar on Proteins,467018,9107,4112
93,YouTube,2025-02-27,https://example.com/post/93/46875132,Post by Vikram Chatterjee on Speciality Supplements,731994,74112,3179
411,YouTube,2022-11-01,https://example.com/post/411/43984506,Post by Karan Malhotra on Multivitamins,615110,15473,4233
252,Twitter,2023-07-16,https://example.com/post/252/70629628,Post by Priya Patel on Vital Herbs,308641,21381,326
149,YouTube,2024-06-02,https://example.com/post/149/67274946,Post by Isha Das on Gainers,116002,90071,1268
496,YouTube,2022-12-29,https://example.com/post/496/36725847,Post by Amit Chopra on Gainers,506566,63783,2040
3,Facebook,2024-09-25,https://example.com/post/3/97761151,Post by Ravi Mehta on Pre/Post Workout,950391,23201,3086
23,YouTube,2024-04-04,https://example.com/post/23/34518599,Post by Divya Sharma on Herbs for Immunity,235275,44623,4780
433,Facebook,2025-04-30,https://example.com/post/433/40699959,Post by Neha Verma on Gainers,749502,58333,951
52,YouTube,2023-06-26,https://example.com/post/52/28683820,Post by Suresh Gupta on Herbs for Personal Care,139410,97089,4957
289,Instagram,2022-09-11,https://example.com/post/289/68800423,Post by Anjali Iyer on Weight Loss Foods,521246,48110,3522
11,YouTube,2025-07-04,https://example.com/post/11/59430818,Post by Vikram Das on Fat Burners,666669,71285,871
215,YouTube,2025-03-21,https://example.com/post/215/14501241,Post by Neha Chatterjee on Speciality Supplements,293450,57235,4565
360,Facebook,2024-12-05,https://example.com/post/360/18984340,Post by Divya Verma on Gainers,69341,11485,2152
450,Instagram,2024-07-26,https://example.com/post/450/73703158,Post by Rohit Mehta on Speciality Supplements,421821,66518,1992
465,Instagram,2023-05-02,https://example.com/post/465/26241805,Post by Anita Sharma on Herbs for Immunity,26280,21283,707
293,Facebook,2023-08-11,https://example.com/post/293/99206598,Post by Pooja Menon on Multivitamins,207063,58521,4472
192,Instagram,2024-01-14,https://example.com/post/192/74139933,Post by Anita Mehta on Pre/Post Workout,71064,86067,1519
299,Facebook,2024-11-17,https://example.com/post/299/25549100,Post by Deepak Chatterjee on Weight Loss Foods,587852,5260,1902
104,YouTube,2023-05-22,https://example.com/post/104/50311369,Post by Neha Mehta on Gainers,140685,97913,3200
6,Instagram,2024-08-24,https://example.com/post/6/18052256,Post by Karan Kapoor on Gainers,535979,1644,923
269,Instagram,2024-01-20,https://example.com/post/269/88594257,Post by Anjali Kumar on Weight Loss Foods,557289,1210,2484
451,Instagram,2023-05-01,https://example.com/post/451/52886482,Post by Karan Mehta on Herbs for Immunity,966457,31989,3935
411,YouTube,2023-10-05,https://example.com/post/411/35322457,Post by Karan Malhotra on Multivitamins,697292,62277,3918
246,Twitter,2023-10-06,https://example.com/post/246/23293865,Post by Deepak Chopra on Gainers,181793,50887,4530
325,YouTube,2022-12-17,https://example.com/post/325/29610873,Post by Anita Kapoor on Weight Loss Foods,700486,16690,4176
75,YouTube,2022-12-11,https://example.com/post/75/74114251,Post by Pooja Gupta on Pre/Post Workout,539322,9564,4637
85,YouTube,2023-12-12,https://example.com/post/85/94146588,Post by Sanya Nair on Weight Loss Foods,791011,54249,2963
481,Facebook,2023-10-29,https://example.com/post/481/45227919,Post by Priya Das on Proteins,427132,7871,3537
22,Facebook,2024-05-11,https://example.com/post/22/62966186,Post by Manish Menon on Speciality Supplements,30009,25295,3061
201,YouTube,2025-01-31,https://example.com/post/201/91394530,Post by Deepak Nair on Herbs for Personal Care,878000,29504,1043
246,Twitter,2025-06-02,https://example.com/post/246/64563778,Post by Deepak Chopra on Gainers,678423,99065,1288
124,Instagram,2025-06-26,https://example.com/post/124/48604733,Post by Amit Iyer on Speciality Supplements,522282,9887,3545
308,YouTube,2022-09-26,https://example.com/post/308/66011264,Post by Shweta Chopra on Multivitamins,70556,73671,695
361,Twitter,2023-05-19,https://example.com/post/361/96087267,Post by Anita Naidu on Multivitamins,42889,48483,2272
202,Instagram,2024-02-20,https://example.com/post/202/72345086,Post by Priya Joshi on Herbs for Personal Care,682749,44808,2486
429,YouTube,2024-05-24,https://example.com/post/429/51358100,Post by Shweta Chopra on Vital Herbs,897929,61642,4189
250,Facebook,2024-09-22,https://example.com/post/250/89129551,Post by Pooja Sharma on Weight Loss Foods,730022,73474,4957
307,Facebook,2023-05-02,https://example.com/post/307/72992151,Post by Anjali Das on Vital Herbs,354449,11975,4011
500,Facebook,2024-06-25,https://example.com/post/500/81503033,Post by Divya Chatterjee on Vital Herbs,543111,80838,515
129,Instagram,2024-01-25,https://example.com/post/129/46406719,Post by Rohit Sharma on Pre/Post Workout,918243,37922,4869
263,Instagram,2023-11-03,https://example.com/post/263/52017078,Post by Amit Das on Herbs for Personal Care,972841,42538,1961
290,Twitter,2023-08-20,https://example.com/post/290/56776651,Post by Vikram Nair on Speciality Supplements,322228,25195,2744
266,Instagram,2024-11-13,https://example.com/post/266/47382608,Post by Rohit Das on Gainers,277729,78399,3472
343,Twitter,2023-08-14,https://example.com/post/343/92282678,Post by Aditya Naidu on Multivitamins,934809,18305,2416
98,Instagram,2024-08-03,https://example.com/post/98/82850150,Post by Vikram Chatterjee on Herbs for Immunity,580761,42142,1674
409,YouTube,2025-02-26,https://example.com/post/409/88081032,Post by Anita Iyer on Herbs for Immunity,546377,22779,960
371,Facebook,2024-03-12,https://example.com/post/371/95710818,Post by Priya Naidu on Vital Herbs,260026,27015,4899
405,Instagram,2024-06-14,https://example.com/post/405/34572290,Post by Priya Malhotra on Pre/Post Workout,931373,84916,4071
192,Instagram,2023-12-10,https://example.com/post/192/62563720,Post by Anita Mehta on Pre/Post Workout,508870,94034,2217
478,YouTube,2025-02-19,https://example.com/post/478/82129763,Post by Karan Iyer on Herbs for Immunity,358983,19231,2086
311,Facebook,2022-12-19,https://example.com/post/311/43894767,Post by Isha Patel on Herbs for Immunity,131473,49406,4511
202,Instagram,2022-07-31,https://example.com/post/202/18931707,Post by Priya Joshi on Herbs for Personal Care,199105,33448,4055
233,Twitter,2024-02-12,https://example.com/post/233/78601151,Post by Rohit Joshi on Gainers,596018,55164,1631
137,YouTube,2022-11-06,https://example.com/post/137/67405901,Post by Priya Kumar on Herbs for Personal Care,659623,64217,4876
56,Facebook,2025-03-26,https://example.com/post/56/68676263,Post by Manish Nair on Proteins,406678,41094,978
72,Twitter,2023-07-30,https://example.com/post/72/26497586,Post by Pooja Joshi on Herbs for Immunity,379887,99681,446
22,Facebook,2022-12-15,https://example.com/post/22/47226095,Post by Manish Menon on Speciality Supplements,113681,71941,4384
138,Instagram,2023-04-11,https://example.com/post/138/22870221,Post by Rohit Nair on Proteins,971716,97439,3467
105,Twitter,2022-10-14,https://example.com/post/105/98623556,Post by Rohit Sharma on Herbs for Personal Care,595088,7898,80
58,Facebook,2024-06-15,https://example.com/post/58/93800183,Post by Isha Kumar on Multivitamins,755525,36379,2328
221,YouTube,2023-11-29,https://example.com/post/221/40935620,Post by Neha Chopra on Proteins,232145,81093,4945
293,Facebook,2024-01-22,https://example.com/post/293/84170836,Post by Pooja Menon on Multivitamins,371725,31030,1242
12,Facebook,2024-05-03,https://example.com/post/12/39510761,Post by Karan Nair on Gainers,181189,50286,1664
278,Twitter,2022-08-29,https://example.com/post/278/31527957,Post by Priya Bhartia on Fat Burners,96606,74923,2209
415,Facebook,2025-04-15,https://example.com/post/415/26718600,Post by Shweta Singh on Herbs for Immunity,101331,32319,3329
114,Twitter,2023-12-02,https://example.com/post/114/71673933,Post by Manish Iyer on Weight Loss Foods,640219,21761,1421
470,Facebook,2023-10-19,https://example.com/post/470/47509920,Post by Sneha Malhotra on Fat Burners,113603,465,1956
344,Instagram,2024-04-16,https://example.com/post/344/68410653,Post by Karan Gupta on Fat Burners,608794,78656,3167
229,YouTube,2023-10-05,https://example.com/post/229/41162770,Post by Anita Bhartia on Weight Loss Foods,106242,10797,3346
365,Twitter,2025-01-19,https://example.com/post/365/69395043,Post by Aditya Mehta on Herbs for Personal Care,158690,96933,3149
436,Twitter,2024-09-10,https://example.com/post/436/13090576,Post by Vikram Joshi on Vital Herbs,568557,35665,1680
452,Twitter,2025-04-26,https://example.com/post/452/68606209,Post by Suresh Menon on Fat Burners,828942,68723,2804
165,Facebook,2022-09-05,https://example.com/post/165/76978961,Post by Sanya Joshi on Vital Herbs,533214,80742,3177
430,Facebook,2025-01-15,https://example.com/post/430/91410291,Post by Manish Chopra on Multivitamins,216450,48934,1183
361,Twitter,2022-12-30,https://example.com/post/361/90658619,Post by Anita Naidu on Multivitamins,878594,91660,3093
87,Facebook,2024-10-29,https://example.com/post/87/37800640,Post by Shweta Naidu on Gainers,229514,41234,2893
208,YouTube,2024-02-06,https://example.com/post/208/43388761,Post by Isha Chatterjee on Fat Burners,750662,38149,1891
195,Twitter,2025-03-12,https://example.com/post/195/13258266,Post by Aditya Menon on Herbs for Immunity,720839,73884,1999
331,Facebook,2022-12-04,https://example.com/post/331/70699404,Post by Manish Joshi on Herbs for Personal Care,748707,2917,3185
293,Facebook,2024-06-30,https://example.com/post/293/58254034,Post by Pooja Menon on Multivitamins,400476,2736,4021
224,Twitter,2025-01-22,https://example.com/post/224/66926814,Post by Suresh Reddy on Weight Loss Foods,94806,57375,2088
179,Twitter,2023-11-05,https://example.com/post/179/46120895,Post by Sanya Bhartia on Weight Loss Foods,385402,34110,3920
81,Facebook,2023-07-05,https://example.com/post/81/39412039,Post by Deepak Singh on Gainers,896113,76791,4236
307,Facebook,2025-07-16,https://example.com/post/307/36268050,Post by Anjali Das on Vital Herbs,887993,4807,3124
187,Twitter,2022-10-31,https://example.com/post/187/40679513,Post by Vikram Patel on Fat Burners,95343,92731,1300
48,YouTube,2022-11-04,https://example.com/post/48/43606927,Post by Shweta Reddy on Herbs for Immunity,84105,68896,2090
232,Facebook,2023-05-26,https://example.com/post/232/49346304,Post by Sanya Sharma on Multivitamins,149514,57183,2281
446,Instagram,2023-08-09,https://example.com/post/446/40747760,Post by Priya Kapoor on Gainers,430354,40891,1365
267,Twitter,2022-12-08,https://example.com/post/267/41113767,Post by Divya Malhotra on Pre/Post Workout,915159,12144,427
294,Instagram,2023-07-20,https://example.com/post/294/48687319,Post by Isha Mehta on Multivitamins,575555,61686,3467
459,Twitter,2023-07-03,https://example.com/post/459/41708297,Post by Amit Gupta on Multivitamins,19016,25659,4936
365,Twitter,2022-12-29,https://example.com/post/365/19043872,Post by Aditya Mehta on Herbs for Personal Care,811377,13355,2204
419,Twitter,2023-07-26,https://example.com/post/419/81666002,Post by Rahul Sharma on Gainers,131167,60675,4533
390,Twitter,2024-08-18,https://example.com/post/390/34014770,Post by Suresh Verma on Herbs for Immunity,161137,69997,1530
126,YouTube,2022-08-11,https://example.com/post/126/53684898,Post by Ravi Malhotra on Proteins,897959,22567,2230
263,Instagram,2022-09-05,https://example.com/post/263/77231416,Post by Amit Das on Herbs for Personal Care,530016,7501,3226
70,Facebook,2023-07-02,https://example.com/post/70/16488684,Post by Vikram Patel on Vital Herbs,492852,20485,1083
