influencer_id,platform,date,URL,caption,reach,likes,comments
179,Twitter,2024-10-03,https://example.com/post/179/62487600,Post by Sanya Bhartia on Weight Loss Foods,76312,69235,2318
145,Twitter,2023-08-28,https://example.com/post/145/83552661,Post by Manish Patel on Pre/Post Workout,413900,12805,1072
166,Facebook,2022-11-12,https://example.com/post/166/50812122,Post by Ravi Chopra on Vital Herbs,480757,85854,1340
296,Twitter,2023-05-02,https://example.com/post/296/69308631,Post by Rohit Kumar on Gainers,730762,63284,2384
460,Facebook,2023-05-17,https://example.com/post/460/38154362,Post by Rohit Patel on Fat Burners,229732,98141,1602
377,Facebook,2022-08-12,https://example.com/post/377/58617120,Post by Anita Chopra on Fat Burners,762221,75505,835
348,Twitter,2023-05-23,https://example.com/post/348/60540462,Post by Priya Naidu on Weight Loss Foods,997564,56032,1378
475,Twitter,2022-11-17,https://example.com/post/475/22891308,Post by Ravi Kumar on Vital Herbs,373856,62161,1471
484,Facebook,2022-11-09,https://example.com/post/484/25750026,Post by Sanya Chatterjee on Gainers,541472,85259,2772
304,Twitter,2024-12-29,https://example.com/post/304/29940502,Post by Aditya Kumar on Proteins,658428,94756,3309
126,YouTube,2022-10-02,https://example.com/post/126/25945407,Post by Ravi Malhotra on Proteins,253555,52039,4002
155,Twitter,2023-07-13,https://example.com/post/155/97616925,Post by Priya Kapoor on Pre/Post Workout,782399,49250,734
399,Instagram,2025-02-28,https://example.com/post/399/97283256,Post by Aditya Mehta on Weight Loss Foods,401661,36123,3646
189,Twitter,2022-08-17,https://example.com/post/189/26106179,Post by Sneha Bhartia on Herbs for Immunity,123292,10881,999
251,Facebook,2025-06-02,https://example.com/post/251/40190270,Post by Rohit Bhartia on Multivitamins,25145,76969,4693
294,Instagram,2025-04-02,https://example.com/post/294/46738721,Post by Isha Mehta on Multivitamins,728424,97745,774
407,Twitter,2023-07-30,https://example.com/post/407/61534222,Post by Sneha Singh on Multivitamins,508711,84538,3552
153,Twitter,2023-04-07,https://example.com/post/153/23346779,Post by Aditya Gupta on Herbs for Immunity,342027,8372,4403
95,Twitter,2024-11-01,https://example.com/post/95/12650315,Post by Neha Malhotra on Herbs for Personal Care,413925,72933,4394
402,Instagram,2025-07-14,https://example.com/post/402/75573851,Post by Suresh Gupta on Proteins,68037,68063,4790
276,Instagram,2023-04-05,https://example.com/post/276/37845315,Post by Vikram Patel on Pre/Post Workout,691573,15428,1480
442,Instagram,2023-07-28,https://example.com/post/442/10714575,Post by Neha Das on Herbs for Personal Care,582667,58669,2574
63,Facebook,2022-10-13,https://example.com/post/63/27289389,Post by Anjali Sharma on Vital Herbs,604016,27080,1320
45,Instagram,2024-01-01,https://example.com/post/45/14698329,Post by Sneha Joshi on Gainers,89720,16396,4146
153,Twitter,2024-08-07,https://example.com/post/153/83071775,Post by Aditya Gupta on Herbs for Immunity,180938,55500,0
128,Instagram,2024-03-31,https://example.com/post/128/16196330,Post by Priya Das on Herbs for Immunity,993177,68134,2403
338,YouTube,2025-07-22,https://example.com/post/338/69716190,Post by Deepak Gupta on Proteins,147648,75687,4017
356,YouTube,2024-04-25,https://example.com/post/356/80151077,Post by Pooja Menon on Vital Herbs,956025,46202,4965
276,Instagram,2025-06-04,https://example.com/post/276/38164181,Post by Vikram Patel on Pre/Post Workout,722347,13027,366
122,YouTube,2022-10-08,https://example.com/post/122/35242818,Post by Suresh Joshi on Herbs for Immunity,149548,39333,1763
491,Twitter,2023-04-25,https://example.com/post/491/90818451,Post by Ravi Sharma on Multivitamins,579888,28366,4847
184,Facebook,2024-02-13,https://example.com/post/184/27245919,Post by Sneha Gupta on Speciality Supplements,765521,81617,3457
39,Instagram,2023-12-29,https://example.com/post/39/44987131,Post by Ravi Das on Weight Loss Foods,401327,85216,1337
205,Twitter,2025-02-13,https://example.com/post/205/21174172,Post by Manish Kapoor on Herbs for Immunity,991632,33365,3484
482,YouTube,2023-05-14,https://example.com/post/482/81927860,Post by Pooja Menon on Herbs for Immunity,214660,9298,2206
325,YouTube,2023-08-23,https://example.com/post/325/59948088,Post by Anita Kapoor on Weight Loss Foods,592021,86205,4189
310,Facebook,2023-06-25,https://example.com/post/310/66329364,Post by Priya Sharma on Herbs for Immunity,862476,20168,2591
404,Twitter,2024-12-29,https://example.com/post/404/60860721,Post by Rahul Nair on Vital Herbs,28168,79166,2027
40,Twitter,2024-01-29,https://example.com/post/40/26726377,Post by Ravi Reddy on Multivitamins,558286,14466,4492
209,Facebook,2022-12-07,https://example.com/post/209/54205616,Post by Rohit Gupta on Fat Burners,672274,11712,2972
466,Facebook,2024-06-07,https://example.com/post/466/46675397,Post by Priya Naidu on Pre/Post Workout,154437,29641,2241
6,Instagram,2023-02-10,https://example.com/post/6/60621018,Post by Karan Kapoor on Gainers,234020,49678,860
401,YouTube,2023-04-03,https://example.com/post/401/33586265,Post by Suresh Naidu on Vital Herbs,553049,95513,2511
302,Facebook,2025-04-22,https://example.com/post/302/22823236,Post by Deepak Gupta on Herbs for Personal Care,555654,45781,4687
444,Facebook,2024-02-22,https://example.com/post/444/84026745,Post by Deepak Verma on Herbs for Immunity,285220,79671,811
460,Facebook,2022-10-31,https://example.com/post/460/32917330,Post by Rohit Patel on Fat Burners,334443,98599,3191
93,YouTube,2024-06-30,https://example.com/post/93/81361168,Post by Vikram Chatterjee on Speciality Supplements,579469,77987,3298
245,Twitter,2023-04-12,https://example.com/post/245/44770583,Post by Ravi Malhotra on Multivitamins,10958,90051,4207
366,Twitter,2023-06-08,https://example.com/post/366/98256603,Post by Rahul Kumar on Weight Loss Foods,133506,18750,3103
291,Facebook,2024-01-23,https://example.com/post/291/17095369,Post by Karan Sharma on Multivitamins,964055,95132,3032
363,Instagram,2023-12-17,https://example.com/post/363/91698732,Post by Sneha Das on Multivitamins,439560,92689,3750
94,Instagram,2025-01-08,https://example.com/post/94/57513265,Post by Neha Menon on Speciality Supplements,838255,61478,4114
147,YouTube,2024-02-09,https://example.com/post/147/67413657,Post by Amit Sharma on Proteins,546883,94220,1874
157,YouTube,2023-01-19,https://example.com/post/157/51025192,Post by Neha Joshi on Speciality Supplements,427261,41041,738
325,YouTube,2023-01-03,https://example.com/post/325/20293588,Post by Anita Kapoor on Weight Loss Foods,766411,31512,767
85,YouTube,2022-11-19,https://example.com/post/85/21352822,Post by Sanya Nair on Weight Loss Foods,780521,37517,4539
476,Twitter,2025-04-29,https://example.com/post/476/11435415,Post by Amit Kapoor on Herbs for Personal Care,995466,55622,4167
478,YouTube,2023-04-30,https://example.com/post/478/74378331,Post by Karan Iyer on Herbs for Immunity,522986,67553,4361
358,Twitter,2023-04-06,https://example.com/post/358/64421457,Post by Deepak Das on Herbs for Personal Care,15575,80827,1557
467,Instagram,2022-08-08,https://example.com/post/467/67039703,Post by Pooja Patel on Speciality Supplements,737720,70085,2826
126,YouTube,2025-07-10,https://example.com/post/126/91764582,Post by Ravi Malhotra on Proteins,45413,79659,3675
494,YouTube,2023-07-05,https://example.com/post/494/80265183,Post by Karan Joshi on Herbs for Personal Care,948701,29550,1432
39,Instagram,2024-08-14,https://example.com/post/39/27893746,Post by Ravi Das on Weight Loss Foods,539637,46356,417
217,Twitter,2025-05-04,https://example.com/post/217/60881238,Post by Anjali Chopra on Proteins,179765,48977,927
174,Instagram,2023-12-18,https://example.com/post/174/82359410,Post by Deepak Sharma on Proteins,893104,15498,2376
154,Twitter,2025-04-09,https://example.com/post/154/49398948,Post by Suresh Iyer on Fat Burners,278611,27976,18
378,Instagram,2024-10-08,https://example.com/post/378/39187415,Post by Divya Reddy on Vital Herbs,968894,40003,4223
423,Facebook,2022-10-05,https://example.com/post/423/72150455,Post by Aditya Gupta on Vital Herbs,936847,81019,3999
30,Instagram,2024-07-22,https://example.com/post/30/10790690,Post by Isha Reddy on Pre/Post Workout,646430,60389,2691
153,Twitter,2024-07-18,https://example.com/post/153/24383316,Post by Aditya Gupta on Herbs for Immunity,6404,45888,1525
206,Instagram,2024-07-20,https://example.com/post/206/11189670,Post by Ravi Kumar on Gainers,107260,56516,4030
102,YouTube,2023-01-14,https://example.com/post/102/81014138,Post by Rahul Menon on Herbs for Personal Care,540302,20197,3364
64,Facebook,2025-04-18,https://example.com/post/64/10927505,Post by Karan Das on Fat Burners,164190,86116,2049
116,YouTube,2025-03-14,https://example.com/post/116/63064163,Post by Sanya Gupta on Herbs for Personal Care,393491,39277,2985
220,Facebook,2023-08-02,https://example.com/post/220/81998064,Post by Pooja Malhotra on Speciality Supplements,851965,35371,890
225,YouTube,2025-01-09,https://example.com/post/225/31721032,Post by Sneha Chatterjee on Proteins,147668,46415,3555
3,Facebook,2024-07-29,https://example.com/post/3/36637470,Post by Ravi Mehta on Pre/Post Workout,117041,24896,2333
21,YouTube,2023-04-24,https://example.com/post/21/62955068,Post by Isha Naidu on Herbs for Immunity,442508,97557,2713
462,Instagram,2022-09-27,https://example.com/post/462/31516779,Post by Manish Das on Speciality Supplements,699566,26132,3926
492,YouTube,2024-01-20,https://example.com/post/492/25944033,Post by Rahul Chatterjee on Fat Burners,442550,64153,4506
254,Twitter,2023-04-11,https://example.com/post/254/53605688,Post by Pooja Iyer on Pre/Post Workout,788574,52462,4111
372,Instagram,2024-09-28,https://example.com/post/372/27638581,Post by Priya Verma on Multivitamins,116063,14189,173
65,Instagram,2023-06-08,https://example.com/post/65/56187078,Post by Aditya Mehta on Vital Herbs,525288,1838,1937
27,Facebook,2024-06-24,https://example.com/post/27/67668666,Post by Suresh Joshi on Multivitamins,627090,96706,65
223,Twitter,2025-04-03,https://example.com/post/223/48851553,Post by Aditya Iyer on Vital Herbs,296932,63741,676
390,Twitter,2024-12-19,https://example.com/post/390/43252079,Post by Suresh Verma on Herbs for Immunity,648614,20037,4188
96,Twitter,2023-12-17,https://example.com/post/96/47733815,Post by Deepak Das on Multivitamins,804972,15125,2158
359,Twitter,2023-12-13,https://example.com/post/359/99433358,Post by Suresh Mehta on Pre/Post Workout,861471,56300,1625
243,Instagram,2023-02-21,https://example.com/post/243/77422120,Post by Rohit Patel on Fat Burners,641785,23798,1545
438,Facebook,2023-05-25,https://example.com/post/438/40787425,Post by Suresh Patel on Fat Burners,127312,17390,3287
20,Instagram,2024-02-05,https://example.com/post/20/35793612,Post by Neha Chopra on Speciality Supplements,975230,19213,3492
10,Twitter,2023-09-06,https://example.com/post/10/22205146,Post by Sanya Gupta on Gainers,907336,6728,3115
209,Facebook,2025-07-04,https://example.com/post/209/51130478,Post by Rohit Gupta on Fat Burners,735169,83059,1895
114,Twitter,2024-06-12,https://example.com/post/114/67186933,Post by Manish Iyer on Weight Loss Foods,503472,8091,4176
219,Instagram,2022-11-07,https://example.com/post/219/50841111,Post by Karan Joshi on Gainers,116400,35340,2978
144,Twitter,2024-07-12,https://example.com/post/144/66112969,Post by Shweta Sharma on Vital Herbs,259965,41972,389
94,Instagram,2022-10-16,https://example.com/post/94/10071931,Post by Neha Menon on Speciality Supplements,55662,86613,2634
109,Facebook,2024-02-29,https://example.com/post/109/73358574,Post by Priya Chatterjee on Herbs for Personal Care,294768,79548,825
221,YouTube,2023-08-07,https://example.com/post/221/43858172,Post by Neha Chopra on Proteins,995394,64443,2978
172,YouTube,2024-04-08,https://example.com/post/172/24969117,Post by Neha Nair on Proteins,102593,87730,111
350,Facebook,2023-04-17,https://example.com/post/350/54454486,Post by Vikram Menon on Proteins,379083,97212,2960
381,Twitter,2025-07-12,https://example.com/post/381/91163313,Post by Deepak Gupta on Vital Herbs,390642,31278,2260
108,Twitter,2024-09-18,https://example.com/post/108/21707969,Post by Manish Menon on Weight Loss Foods,931290,13991,1068
323,Facebook,2023-03-28,https://example.com/post/323/15508152,Post by Deepak Kapoor on Speciality Supplements,616054,85817,1560
99,Instagram,2025-01-22,https://example.com/post/99/23238889,Post by Suresh Patel on Fat Burners,79516,71691,2809
155,Twitter,2025-03-22,https://example.com/post/155/37111862,Post by Priya Kapoor on Pre/Post Workout,560475,94522,1258
23,YouTube,2023-04-12,https://example.com/post/23/35730441,Post by Divya Sharma on Herbs for Immunity,439527,72204,2068
457,Twitter,2024-07-05,https://example.com/post/457/59125302,Post by Deepak Joshi on Vital Herbs,471267,82607,961
467,Instagram,2025-01-03,https://example.com/post/467/19087680,Post by Pooja Patel on Speciality Supplements,507274,54969,4290
477,Twitter,2025-05-21,https://example.com/post/477/12935999,Post by Rahul Kumar on Weight Loss Foods,176044,78582,2245
357,Twitter,2023-04-15,https://example.com/post/357/48877018,Post by Rahul Chopra on Pre/Post Workout,48652,74259,498
407,Twitter,2023-08-18,https://example.com/post/407/63350718,Post by Sneha Singh on Multivitamins,520072,89794,4361
446,Instagram,2025-06-10,https://example.com/post/446/20064387,Post by Priya Kapoor on Gainers,174558,57426,4172
197,Facebook,2024-10-01,https://example.com/post/197/63801036,Post by Divya Malhotra on Gainers,637714,35635,1695
95,Twitter,2022-08-01,https://example.com/post/95/31475246,Post by Neha Malhotra on Herbs for Personal Care,600678,28598,4850
357,Twitter,2022-08-12,https://example.com/post/357/78826270,Post by Rahul Chopra on Pre/Post Workout,478564,66086,4301
133,Facebook,2024-04-06,https://example.com/post/133/39573041,Post by Vikram Malhotra on Pre/Post Workout,311759,92882,2199
283,Twitter,2023-03-25,https://example.com/post/283/32965874,Post by Rohit Chatterjee on Herbs for Immunity,235807,6028,4370
122,YouTube,2024-03-13,https://example.com/post/122/15246661,Post by Suresh Joshi on Herbs for Immunity,671685,19466,2275
475,Twitter,2023-04-23,https://example.com/post/475/46297151,Post by Ravi Kumar on Vital Herbs,916808,6802,2039
422,Twitter,2023-09-28,https://example.com/post/422/81752116,Post by Ravi Verma on Weight Loss Foods,122828,233,2846
324,YouTube,2024-08-18,https://example.com/post/324/53561957,Post by Shweta Chopra on Fat Burners,88289,92516,4499
136,Twitter,2023-04-24,https://example.com/post/136/64806853,Post by Priya Gupta on Vital Herbs,942973,80198,2415
167,Instagram,2022-11-19,https://example.com/post/167/94014298,Post by Sanya Das on Herbs for Immunity,856556,1414,2912
113,Facebook,2024-02-17,https://example.com/post/113/33721002,Post by Suresh Singh on Weight Loss Foods,269422,2099,4402
337,YouTube,2023-02-27,https://example.com/post/337/61268618,Post by Pooja Sharma on Herbs for Personal Care,992592,85748,2108
446,Instagram,2023-09-20,https://example.com/post/446/69349051,Post by Priya Kapoor on Gainers,232356,42551,2201
105,Twitter,2024-10-11,https://example.com/post/105/30889845,Post by Rohit Sharma on Herbs for Personal Care,468723,30422,3554
189,Twitter,2023-05-24,https://example.com/post/189/74291216,Post by Sneha Bhartia on Herbs for Immunity,99242,65056,1486
236,Twitter,2023-08-07,https://example.com/post/236/33637158,Post by Anita Patel on Fat Burners,199033,74716,4018
483,YouTube,2023-07-29,https://example.com/post/483/96914605,Post by Ravi Verma on Multivitamins,296744,2808,2540
84,YouTube,2023-07-23,https://example.com/post/84/62908270,Post by Suresh Das on Multivitamins,721756,79718,1538
36,Twitter,2023-05-14,https://example.com/post/36/19670211,Post by Manish Das on Proteins,448107,32195,3727
466,Facebook,2024-10-26,https://example.com/post/466/23453152,Post by Priya Naidu on Pre/Post Workout,760490,69095,1124
373,Facebook,2022-08-18,https://example.com/post/373/90972685,Post by Sneha Chatterjee on Herbs for Personal Care,105574,49578,3145
11,YouTube,2023-03-07,https://example.com/post/11/11818926,Post by Vikram Das on Fat Burners,801530,84523,358
68,YouTube,2023-12-15,https://example.com/post/68/21220004,Post by Sneha Sharma on Herbs for Personal Care,281658,18745,4912
7,Twitter,2022-08-13,https://example.com/post/7/24272571,Post by Rahul Verma on Herbs for Personal Care,569716,96536,2772
437,Twitter,2023-01-15,https://example.com/post/437/37155151,Post by Rohit Iyer on Herbs for Personal Care,146993,63020,4610
457,Twitter,2025-01-19,https://example.com/post/457/31896876,Post by Deepak Joshi on Vital Herbs,323316,43533,3923
80,Facebook,2023-12-06,https://example.com/post/80/17499483,Post by Anita Mehta on Vital Herbs,570928,90757,2191
322,Instagram,2023-04-03,https://example.com/post/322/12846476,Post by Rohit Joshi on Vital Herbs,865996,5886,842
279,Instagram,2024-03-23,https://example.com/post/279/23766187,Post by Rahul Joshi on Herbs for Immunity,537391,54482,1161
1,Facebook,2023-10-27,https://example.com/post/1/13221342,Post by Isha Singh on Herbs for Immunity,238686,56035,3157
76,Twitter,2024-07-17,https://example.com/post/76/97961547,Post by Priya Das on Speciality Supplements,301780,29657,3151
352,Twitter,2023-03-12,https://example.com/post/352/76011040,Post by Ravi Bhartia on Gainers,178795,14485,1839
53,Facebook,2024-02-22,https://example.com/post/53/57957055,Post by Isha Joshi on Herbs for Immunity,80995,80750,2733
61,Twitter,2024-08-01,https://example.com/post/61/21382241,Post by Rohit Joshi on Pre/Post Workout,940090,5731,4952
78,Instagram,2023-07-24,https://example.com/post/78/67529530,Post by Pooja Reddy on Pre/Post Workout,557249,43938,4912
93,YouTube,2024-12-11,https://example.com/post/93/30162191,Post by Vikram Chatterjee on Speciality Supplements,937501,87510,2470
320,Twitter,2024-03-03,https://example.com/post/320/56759534,Post by Rohit Chopra on Gainers,918925,13671,2220
470,Facebook,2025-05-12,https://example.com/post/470/98816127,Post by Sneha Malhotra on Fat Burners,388042,34836,625
404,Twitter,2022-07-29,https://example.com/post/404/29950518,Post by Rahul Nair on Vital Herbs,816565,86014,1200
164,Facebook,2023-05-23,https://example.com/post/164/62425387,Post by Sneha Gupta on Fat Burners,469394,94597,3919
418,YouTube,2022-12-09,https://example.com/post/418/25188619,Post by Vikram Joshi on Vital Herbs,606912,56077,2281
75,YouTube,2023-01-26,https://example.com/post/75/53359494,Post by Pooja Gupta on Pre/Post Workout,134730,23888,3154
181,Facebook,2024-05-08,https://example.com/post/181/76331270,Post by Vikram Malhotra on Vital Herbs,445420,63133,3391
309,Facebook,2024-06-06,https://example.com/post/309/28551745,Post by Neha Joshi on Fat Burners,842105,85765,2014
197,Facebook,2024-11-28,https://example.com/post/197/83731067,Post by Divya Malhotra on Gainers,522249,70664,4372
253,Facebook,2025-07-19,https://example.com/post/253/81969231,Post by Rohit Gupta on Speciality Supplements,862304,30211,3150
43,Instagram,2024-12-04,https://example.com/post/43/80725487,Post by Deepak Mehta on Herbs for Immunity,606947,90948,1796
360,Facebook,2023-01-19,https://example.com/post/360/41567079,Post by Divya Verma on Gainers,380279,425,1665
436,Twitter,2022-08-29,https://example.com/post/436/58640295,Post by Vikram Joshi on Vital Herbs,586498,62168,1094
472,Facebook,2023-03-07,https://example.com/post/472/17996341,Post by Deepak Chatterjee on Proteins,956632,45839,2956
435,Facebook,2023-05-06,https://example.com/post/435/49553600,Post by Ravi Chatterjee on Speciality Supplements,483752,18942,4517
498,YouTube,2024-12-03,https://example.com/post/498/42547451,Post by Amit Kumar on Proteins,221974,29487,457
383,Facebook,2023-05-03,https://example.com/post/383/25735123,Post by Suresh Chatterjee on Vital Herbs,730578,92319,1172
194,YouTube,2022-09-16,https://example.com/post/194/67003442,Post by Aditya Joshi on Proteins,390739,7138,868
340,Facebook,2022-12-23,https://example.com/post/340/73998578,Post by Suresh Nair on Multivitamins,879116,77897,1295
16,Facebook,2023-05-21,https://example.com/post/16/59022249,Post by Neha Das on Multivitamins,149140,10403,2007
40,Twitter,2022-08-19,https://example.com/post/40/86394469,Post by Ravi Reddy on Multivitamins,872437,54640,1226
392,Instagram,2023-08-02,https://example.com/post/392/73050755,Post by Shweta Chatterjee on Proteins,780677,18414,4320
358,Twitter,2024-03-29,https://example.com/post/358/73107095,Post by Deepak Das on Herbs for Personal Care,432512,94757,2763
228,Twitter,2022-08-21,https://example.com/post/228/48489493,Post by Rahul Kumar on Vital Herbs,117671,20482,491
452,Twitter,2022-09-28,https://example.com/post/452/91090807,Post by Suresh Menon on Fat Burners,788619,22801,4122
83,Twitter,2022-08-16,https://example.com/post/83/63202657,Post by Deepak Das on Weight Loss Foods,874128,55574,3721
284,Twitter,2024-01-04,https://example.com/post/284/86781282,Post by Rahul Joshi on Multivitamins,527251,40162,1862
217,Twitter,2023-06-11,https://example.com/post/217/46484083,Post by Anjali Chopra on Proteins,97402,68404,3092
487,Instagram,2023-04-07,https://example.com/post/487/38435937,Post by Amit Kumar on Pre/Post Workout,420852,81189,458
113,Facebook,2024-10-05,https://example.com/post/113/34654960,Post by Suresh Singh on Weight Loss Foods,863458,97829,4581
310,Facebook,2022-12-30,https://example.com/post/310/72872428,Post by Priya Sharma on Herbs for Immunity,501607,41100,3318
424,Facebook,2024-09-11,https://example.com/post/424/32122351,Post by Anita Joshi on Multivitamins,58327,48740,3475
100,Facebook,2024-01-28,https://example.com/post/100/24549320,Post by Aditya Reddy on Pre/Post Workout,110471,10248,2971
309,Facebook,2024-06-11,https://example.com/post/309/13764654,Post by Neha Joshi on Fat Burners,252165,37039,1333
278,Twitter,2023-02-28,https://example.com/post/278/18766990,Post by Priya Bhartia on Fat Burners,223203,78314,89
388,Twitter,2024-04-18,https://example.com/post/388/35198547,Post by Karan Sharma on Speciality Supplements,579490,26490,265
124,Instagram,2024-01-27,https://example.com/post/124/21413788,Post by Amit Iyer on Speciality Supplements,598817,74079,367
289,Instagram,2025-04-10,https://example.com/post/289/16131148,Post by Anjali Iyer on Weight Loss Foods,51382,41282,763
484,Facebook,2024-04-17,https://example.com/post/484/11137995,Post by Sanya Chatterjee on Gainers,374973,98574,2313
491,Twitter,2024-10-17,https://example.com/post/491/77137866,Post by Ravi Sharma on Multivitamins,205350,41268,3200
372,Instagram,2024-07-22,https://example.com/post/372/27383462,Post by Priya Verma on Multivitamins,737789,88482,797
170,Facebook,2024-11-05,https://example.com/post/170/77589149,Post by Pooja Mehta on Vital Herbs,106909,65871,1230
13,Facebook,2024-09-14,https://example.com/post/13/74015552,Post by Anjali Das on Vital Herbs,615841,4953,2376
83,Twitter,2023-05-31,https://example.com/post/83/72157065,Post by Deepak Das on Weight Loss Foods,83578,82094,764
488,Twitter,2023-11-11,https://example.com/post/488/38943676,Post by Isha Kapoor on Fat Burners,847699,89370,1153
394,Facebook,2023-06-19,https://example.com/post/394/77326285,Post by Karan Kapoor on Pre/Post Workout,542380,95564,4986
334,YouTube,2025-06-30,https://example.com/post/334/55823984,Post by Vikram Chopra on Speciality Supplements,470217,17246,2777
149,YouTube,2024-07-31,https://example.com/post/149/93680829,Post by Isha Das on Gainers,898531,56529,327
457,Twitter,2024-09-25,https://example.com/post/457/42092885,Post by Deepak Joshi on Vital Herbs,219964,80054,4971
39,Instagram,2023-06-02,https://example.com/post/39/86088145,Post by Ravi Das on Weight Loss Foods,659285,65261,797
413,Instagram,2022-08-24,https://example.com/post/413/29142470,Post by Neha Joshi on Gainers,804541,40622,4482
445,Twitter,2023-01-19,https://example.com/post/445/76962870,Post by Divya Iyer on Fat Burners,99685,59662,2569
87,Facebook,2024-03-21,https://example.com/post/87/31672470,Post by Shweta Naidu on Gainers,72472,36765,4722
187,Twitter,2024-07-17,https://example.com/post/187/21976146,Post by Vikram Patel on Fat Burners,75589,23536,3774
133,Facebook,2025-03-20,https://example.com/post/133/44363268,Post by Vikram Malhotra on Pre/Post Workout,801216,57989,1150
482,YouTube,2023-04-04,https://example.com/post/482/86334111,Post by Pooja Menon on Herbs for Immunity,512976,5239,2977
440,YouTube,2024-03-03,https://example.com/post/440/63813150,Post by Shweta Chatterjee on Gainers,429902,81273,1056
226,YouTube,2024-08-14,https://example.com/post/226/78783800,Post by Anita Chatterjee on Herbs for Personal Care,886874,81921,2569
192,Instagram,2023-01-11,https://example.com/post/192/65457991,Post by Anita Mehta on Pre/Post Workout,531519,59044,2153
450,Instagram,2022-10-20,https://example.com/post/450/93297363,Post by Rohit Mehta on Speciality Supplements,676143,7528,2005
359,Twitter,2022-08-10,https://example.com/post/359/30744991,Post by Suresh Mehta on Pre/Post Workout,895498,13851,2381
193,Instagram,2023-06-14,https://example.com/post/193/86522053,Post by Vikram Joshi on Multivitamins,419675,9615,1827
199,Twitter,2025-02-25,https://example.com/post/199/99811868,Post by Sneha Iyer on Vital Herbs,99045,45785,3816
240,Facebook,2025-07-24,https://example.com/post/240/72391513,Post by Sneha Das on Gainers,115419,11298,1476
375,Facebook,2023-03-03,https://example.com/post/375/63277039,Post by Sanya Patel on Vital Herbs,806533,56819,1634
206,Instagram,2024-05-28,https://example.com/post/206/18653222,Post by Ravi Kumar on Gainers,333697,44932,4950
249,Instagram,2023-10-03,https://example.com/post/249/73917095,Post by Amit Mehta on Pre/Post Workout,120879,36537,3723
20,Instagram,2023-06-08,https://example.com/post/20/73077976,Post by Neha Chopra on Speciality Supplements,153582,83964,1748
164,Facebook,2022-09-27,https://example.com/post/164/90675244,Post by Sneha Gupta on Fat Burners,812813,49894,511
480,Facebook,2024-08-03,https://example.com/post/480/67728351,Post by Sneha Sharma on Speciality Supplements,497405,28023,443
