influencer_id,platform,date,URL,caption,reach,likes,comments
470,Facebook,2024-01-26,https://example.com/post/470/77025580,Post by Sneha Malhotra on Fat Burners,347895,59495,3288
301,YouTube,2024-01-25,https://example.com/post/301/95325945,Post by Divya Gupta on Gainers,352800,26181,2953
496,YouTube,2023-11-28,https://example.com/post/496/68597599,Post by Amit Chopra on Gainers,389726,74016,3868
439,Twitter,2024-01-30,https://example.com/post/439/62751253,Post by Rahul Menon on Herbs for Personal Care,406441,95487,4871
398,Facebook,2025-05-19,https://example.com/post/398/61312479,Post by Aditya Chatterjee on Multivitamins,847088,8383,3529
107,Facebook,2024-02-19,https://example.com/post/107/26974940,Post by Amit Sharma on Vital Herbs,83919,23260,2811
147,YouTube,2024-08-20,https://example.com/post/147/12969702,Post by Amit Sharma on Proteins,562498,91504,64
294,Instagram,2024-06-04,https://example.com/post/294/92990227,Post by Isha Mehta on Multivitamins,962612,40203,4161
45,Instagram,2024-06-23,https://example.com/post/45/34879238,Post by Sneha Joshi on Gainers,798355,52360,4881
74,Instagram,2024-05-16,https://example.com/post/74/59823728,Post by Anjali Chopra on Herbs for Personal Care,604682,50026,3252
155,Twitter,2025-01-24,https://example.com/post/155/34390563,Post by Priya Kapoor on Pre/Post Workout,119323,31445,110
233,Twitter,2024-02-10,https://example.com/post/233/28348753,Post by Rohit Joshi on Gainers,252236,48276,4821
61,Twitter,2024-01-20,https://example.com/post/61/34372953,Post by Rohit Joshi on Pre/Post Workout,404498,16111,2342
27,Facebook,2024-01-18,https://example.com/post/27/97330798,Post by Suresh Joshi on Multivitamins,571909,76533,1600
127,Twitter,2023-06-12,https://example.com/post/127/65761575,Post by Ravi Reddy on Gainers,857244,15299,2465
398,Facebook,2024-05-03,https://example.com/post/398/51466066,Post by Aditya Chatterjee on Multivitamins,224861,94211,457
232,Facebook,2024-11-16,https://example.com/post/232/39529338,Post by Sanya Sharma on Multivitamins,690738,60067,1851
54,Facebook,2022-08-31,https://example.com/post/54/14024877,Post by Vikram Gupta on Herbs for Personal Care,561105,84672,999
254,Twitter,2025-07-16,https://example.com/post/254/57817462,Post by Pooja Iyer on Pre/Post Workout,965430,21940,1163
478,YouTube,2023-03-28,https://example.com/post/478/20656998,Post by Karan Iyer on Herbs for Immunity,387253,95718,4497
229,YouTube,2023-01-30,https://example.com/post/229/84756776,Post by Anita Bhartia on Weight Loss Foods,295493,41774,1281
108,Twitter,2024-08-05,https://example.com/post/108/98307414,Post by Manish Menon on Weight Loss Foods,293930,96928,1443
222,Instagram,2025-05-25,https://example.com/post/222/71828022,Post by Karan Joshi on Herbs for Immunity,273379,35053,4080
25,Instagram,2023-03-12,https://example.com/post/25/76735750,Post by Aditya Sharma on Fat Burners,204419,84305,1340
446,Instagram,2022-09-14,https://example.com/post/446/81006112,Post by Priya Kapoor on Gainers,431883,44802,1209
114,Twitter,2025-01-20,https://example.com/post/114/72115842,Post by Manish Iyer on Weight Loss Foods,475969,17358,4729
221,YouTube,2024-10-21,https://example.com/post/221/53474974,Post by Neha Chopra on Proteins,427495,24730,1597
240,Facebook,2022-07-31,https://example.com/post/240/24961937,Post by Sneha Das on Gainers,293193,8169,382
474,Twitter,2024-07-25,https://example.com/post/474/30468290,Post by Deepak Malhotra on Herbs for Immunity,854196,57633,4399
33,Facebook,2022-09-13,https://example.com/post/33/59323356,Post by Divya Reddy on Herbs for Immunity,342294,85125,4252
338,YouTube,2022-10-26,https://example.com/post/338/14881035,Post by Deepak Gupta on Proteins,27547,19970,3963
439,Twitter,2023-07-24,https://example.com/post/439/27183032,Post by Rahul Menon on Herbs for Personal Care,69904,40575,1526
164,Facebook,2025-02-27,https://example.com/post/164/98928380,Post by Sneha Gupta on Fat Burners,888810,25591,982
218,YouTube,2022-09-17,https://example.com/post/218/91096407,Post by Manish Iyer on Herbs for Personal Care,316751,29765,4699
355,Twitter,2023-04-03,https://example.com/post/355/39208016,Post by Vikram Verma on Pre/Post Workout,801130,52216,4334
413,Instagram,2023-01-18,https://example.com/post/413/76354175,Post by Neha Joshi on Gainers,173468,4648,1625
63,Facebook,2023-09-03,https://example.com/post/63/60745502,Post by Anjali Sharma on Vital Herbs,653669,45382,2875
364,YouTube,2023-06-05,https://example.com/post/364/79537865,Post by Suresh Das on Herbs for Immunity,814239,51268,1441
465,Instagram,2022-09-17,https://example.com/post/465/90655868,Post by Anita Sharma on Herbs for Immunity,677200,24493,4715
372,Instagram,2025-04-12,https://example.com/post/372/43035177,Post by Priya Verma on Multivitamins,361678,16803,3059
495,Facebook,2024-07-15,https://example.com/post/495/98486242,Post by Sneha Reddy on Speciality Supplements,717057,27995,1922
76,Twitter,2023-07-06,https://example.com/post/76/30236850,Post by Priya Das on Speciality Supplements,672022,90912,3626
117,YouTube,2023-08-18,https://example.com/post/117/80090170,Post by Manish Naidu on Fat Burners,633700,79731,1427
1,Facebook,2024-03-04,https://example.com/post/1/58800300,Post by Isha Singh on Herbs for Immunity,895292,62136,1819
401,YouTube,2024-07-19,https://example.com/post/401/40266345,Post by Suresh Naidu on Vital Herbs,136478,29755,3467
219,Instagram,2023-01-19,https://example.com/post/219/78085419,Post by Karan Joshi on Gainers,368010,4605,3846
204,YouTube,2023-01-28,https://example.com/post/204/16570619,Post by Shweta Das on Vital Herbs,579003,60227,373
262,Facebook,2023-08-12,https://example.com/post/262/62222770,Post by Deepak Joshi on Proteins,637626,65302,989
392,Instagram,2025-05-25,https://example.com/post/392/31259406,Post by Shweta Chatterjee on Proteins,871071,26251,3122
20,Instagram,2023-02-12,https://example.com/post/20/11900451,Post by Neha Chopra on Speciality Supplements,516262,16392,1277
203,Twitter,2023-02-14,https://example.com/post/203/57542705,Post by Suresh Mehta on Vital Herbs,677128,72614,1820
458,Facebook,2023-08-03,https://example.com/post/458/22031352,Post by Manish Menon on Speciality Supplements,901758,64667,3561
473,Twitter,2024-01-12,https://example.com/post/473/81690032,Post by Sanya Joshi on Fat Burners,902281,33902,3297
245,Twitter,2023-09-08,https://example.com/post/245/53528399,Post by Ravi Malhotra on Multivitamins,465116,98845,2151
68,YouTube,2023-05-18,https://example.com/post/68/38161588,Post by Sneha Sharma on Herbs for Personal Care,228216,90601,1251
73,Twitter,2023-06-20,https://example.com/post/73/78230692,Post by Pooja Naidu on Multivitamins,18707,83246,869
387,Facebook,2024-03-14,https://example.com/post/387/44058594,Post by Amit Mehta on Fat Burners,162447,45414,4589
344,Instagram,2023-06-05,https://example.com/post/344/99255332,Post by Karan Gupta on Fat Burners,719618,82800,1508
92,Facebook,2024-07-18,https://example.com/post/92/64361854,Post by Suresh Naidu on Herbs for Personal Care,60936,49467,1499
421,Instagram,2024-06-15,https://example.com/post/421/38328468,Post by Manish Das on Weight Loss Foods,390641,86044,403
461,Twitter,2024-09-29,https://example.com/post/461/42513327,Post by Karan Bhartia on Weight Loss Foods,874585,83337,3922
443,Instagram,2023-12-08,https://example.com/post/443/18948174,Post by Amit Sharma on Herbs for Immunity,897620,84952,939
273,Instagram,2022-11-15,https://example.com/post/273/46447632,Post by Anjali Das on Speciality Supplements,417095,89660,4028
142,Twitter,2023-02-24,https://example.com/post/142/41717630,Post by Anjali Kapoor on Vital Herbs,7619,63694,2582
118,YouTube,2024-04-09,https://example.com/post/118/26377872,Post by Pooja Nair on Pre/Post Workout,685931,73671,2653
77,Facebook,2022-08-21,https://example.com/post/77/98582538,Post by Anjali Kumar on Herbs for Immunity,76221,28853,3156
90,Twitter,2024-10-23,https://example.com/post/90/98731132,Post by Manish Bhartia on Herbs for Personal Care,61116,66728,2349
340,Facebook,2024-10-19,https://example.com/post/340/40767884,Post by Suresh Nair on Multivitamins,599643,94434,3879
337,YouTube,2024-08-11,https://example.com/post/337/61823655,Post by Pooja Sharma on Herbs for Personal Care,67330,41184,2267
405,Instagram,2025-03-26,https://example.com/post/405/16044217,Post by Priya Malhotra on Pre/Post Workout,380093,41786,2059
292,YouTube,2022-12-20,https://example.com/post/292/33391451,Post by Priya Kumar on Fat Burners,983288,82128,551
189,Twitter,2023-01-18,https://example.com/post/189/67461167,Post by Sneha Bhartia on Herbs for Immunity,756373,35133,589
40,Twitter,2024-06-24,https://example.com/post/40/54284913,Post by Ravi Reddy on Multivitamins,450068,35651,138
292,YouTube,2023-01-28,https://example.com/post/292/87340546,Post by Priya Kumar on Fat Burners,756914,49329,4853
109,Facebook,2024-05-12,https://example.com/post/109/70513308,Post by Priya Chatterjee on Herbs for Personal Care,574698,65147,2930
413,Instagram,2023-08-07,https://example.com/post/413/18079655,Post by Neha Joshi on Gainers,501338,119,1123
10,Twitter,2023-12-26,https://example.com/post/10/32646191,Post by Sanya Gupta on Gainers,456707,20798,122
37,Twitter,2025-05-06,https://example.com/post/37/22897516,Post by Shweta Sharma on Pre/Post Workout,143559,95596,735
77,Facebook,2024-04-14,https://example.com/post/77/19837032,Post by Anjali Kumar on Herbs for Immunity,987501,26498,4682
125,Twitter,2024-12-21,https://example.com/post/125/93255820,Post by Vikram Iyer on Gainers,424135,60704,4357
291,Facebook,2025-02-08,https://example.com/post/291/64490175,Post by Karan Sharma on Multivitamins,39100,74288,4286
243,Instagram,2023-10-09,https://example.com/post/243/19958063,Post by Rohit Patel on Fat Burners,173987,55934,4018
458,Facebook,2025-04-10,https://example.com/post/458/41047809,Post by Manish Menon on Speciality Supplements,84784,78947,1518
68,YouTube,2025-01-06,https://example.com/post/68/97514564,Post by Sneha Sharma on Herbs for Personal Care,409319,88517,231
236,Twitter,2024-06-18,https://example.com/post/236/87413513,Post by Anita Patel on Fat Burners,557183,70142,3892
333,YouTube,2024-12-01,https://example.com/post/333/57300592,Post by Shweta Menon on Speciality Supplements,249755,83595,1703
482,YouTube,2024-04-17,https://example.com/post/482/37248252,Post by Pooja Menon on Herbs for Immunity,121888,79036,751
323,Facebook,2024-09-14,https://example.com/post/323/54132892,Post by Deepak Kapoor on Speciality Supplements,324765,24740,252
489,Twitter,2025-06-08,https://example.com/post/489/87607161,Post by Deepak Joshi on Gainers,668873,43942,1488
120,Facebook,2023-04-06,https://example.com/post/120/29425562,Post by Vikram Malhotra on Weight Loss Foods,48899,20830,991
301,YouTube,2022-12-13,https://example.com/post/301/57240995,Post by Divya Gupta on Gainers,884073,3132,2859
249,Instagram,2024-09-06,https://example.com/post/249/46545801,Post by Amit Mehta on Pre/Post Workout,297525,73848,3736
410,Instagram,2024-02-26,https://example.com/post/410/74416180,Post by Suresh Malhotra on Proteins,8222,93237,409
1,Facebook,2023-05-08,https://example.com/post/1/66487529,Post by Isha Singh on Herbs for Immunity,589526,60902,3241
157,YouTube,2024-04-18,https://example.com/post/157/83115848,Post by Neha Joshi on Speciality Supplements,698702,99994,3565
255,Facebook,2024-10-23,https://example.com/post/255/49962506,Post by Priya Gupta on Vital Herbs,601200,58747,4858
231,Facebook,2024-04-18,https://example.com/post/231/21948986,Post by Divya Joshi on Pre/Post Workout,441181,26435,3159
456,YouTube,2024-07-05,https://example.com/post/456/67261364,Post by Isha Reddy on Herbs for Immunity,725174,4476,2104
440,YouTube,2024-06-01,https://example.com/post/440/14432708,Post by Shweta Chatterjee on Gainers,25173,53357,2001
181,Facebook,2024-04-29,https://example.com/post/181/39607195,Post by Vikram Malhotra on Vital Herbs,494103,26156,308
302,Facebook,2024-09-22,https://example.com/post/302/46560856,Post by Deepak Gupta on Herbs for Personal Care,593493,55968,1527
493,YouTube,2025-03-02,https://example.com/post/493/69240944,Post by Ravi Reddy on Weight Loss Foods,83919,14456,4632
333,YouTube,2024-07-27,https://example.com/post/333/28435232,Post by Shweta Menon on Speciality Supplements,597964,91268,3114
115,Twitter,2024-05-12,https://example.com/post/115/37633907,Post by Priya Singh on Gainers,52952,91108,3038
304,Twitter,2025-03-05,https://example.com/post/304/11067974,Post by Aditya Kumar on Proteins,188953,48285,2865
57,Instagram,2023-06-20,https://example.com/post/57/81003352,Post by Vikram Menon on Speciality Supplements,169927,60693,3387
346,YouTube,2023-09-20,https://example.com/post/346/67252780,Post by Anjali Patel on Vital Herbs,315268,30821,641
437,Twitter,2024-04-28,https://example.com/post/437/92420626,Post by Rohit Iyer on Herbs for Personal Care,305066,68799,4584
431,YouTube,2024-06-10,https://example.com/post/431/92104213,Post by Amit Kapoor on Multivitamins,413584,45752,2307
212,YouTube,2024-12-31,https://example.com/post/212/43287832,Post by Rohit Nair on Proteins,314038,43357,2144
448,Facebook,2024-03-14,https://example.com/post/448/39716697,Post by Suresh Menon on Fat Burners,323323,92984,2108
403,YouTube,2022-12-21,https://example.com/post/403/50983721,Post by Isha Joshi on Multivitamins,642714,15950,3240
292,YouTube,2023-12-07,https://example.com/post/292/91532029,Post by Priya Kumar on Fat Burners,255235,92545,2117
142,Twitter,2025-02-02,https://example.com/post/142/48263982,Post by Anjali Kapoor on Vital Herbs,238413,75405,2208
450,Instagram,2024-11-10,https://example.com/post/450/45405879,Post by Rohit Mehta on Speciality Supplements,19010,68970,4598
88,Twitter,2023-05-20,https://example.com/post/88/40135742,Post by Neha Joshi on Pre/Post Workout,51063,77817,2688
257,Instagram,2024-12-01,https://example.com/post/257/27220631,Post by Suresh Sharma on Weight Loss Foods,635848,94808,3907
371,Facebook,2023-10-15,https://example.com/post/371/87258340,Post by Priya Naidu on Vital Herbs,702505,69934,4279
299,Facebook,2024-01-28,https://example.com/post/299/23389421,Post by Deepak Chatterjee on Weight Loss Foods,262281,20719,848
496,YouTube,2022-08-10,https://example.com/post/496/86639255,Post by Amit Chopra on Gainers,468185,16969,501
354,Instagram,2023-07-14,https://example.com/post/354/25454302,Post by Priya Nair on Fat Burners,903217,62799,355
246,Twitter,2024-05-24,https://example.com/post/246/50447664,Post by Deepak Chopra on Gainers,943919,68020,2848
99,Instagram,2024-03-03,https://example.com/post/99/94597065,Post by Suresh Patel on Fat Burners,745232,54156,3035
173,YouTube,2025-03-18,https://example.com/post/173/88598588,Post by Sanya Chopra on Fat Burners,139319,16520,305
126,YouTube,2022-08-14,https://example.com/post/126/15759381,Post by Ravi Malhotra on Proteins,317430,36506,4642
222,Instagram,2024-04-08,https://example.com/post/222/61204257,Post by Karan Joshi on Herbs for Immunity,975022,8450,1215
371,Facebook,2023-10-25,https://example.com/post/371/86044212,Post by Priya Naidu on Vital Herbs,58260,3639,1158
460,Facebook,2024-07-22,https://example.com/post/460/24312453,Post by Rohit Patel on Fat Burners,143984,15096,1671
376,YouTube,2025-02-24,https://example.com/post/376/54737245,Post by Sneha Joshi on Weight Loss Foods,901172,51624,2918
271,Instagram,2024-10-04,https://example.com/post/271/35543591,Post by Aditya Verma on Gainers,347834,76379,2763
322,Instagram,2025-03-16,https://example.com/post/322/10310959,Post by Rohit Joshi on Vital Herbs,583355,56442,646
473,Twitter,2023-10-15,https://example.com/post/473/19232076,Post by Sanya Joshi on Fat Burners,274774,92562,2953
283,Twitter,2024-03-27,https://example.com/post/283/35387628,Post by Rohit Chatterjee on Herbs for Immunity,272974,91245,2680
204,YouTube,2024-09-26,https://example.com/post/204/39700674,Post by Shweta Das on Vital Herbs,89753,9549,1825
479,Instagram,2024-08-22,https://example.com/post/479/16450225,Post by Suresh Malhotra on Multivitamins,929008,26880,2429
456,YouTube,2023-08-04,https://example.com/post/456/35567631,Post by Isha Reddy on Herbs for Immunity,870074,53448,1290
478,YouTube,2023-04-28,https://example.com/post/478/14494343,Post by Karan Iyer on Herbs for Immunity,900652,32642,1596
159,YouTube,2025-02-15,https://example.com/post/159/49292923,Post by Manish Joshi on Gainers,193006,34800,3330
107,Facebook,2023-03-02,https://example.com/post/107/12512095,Post by Amit Sharma on Vital Herbs,316891,30457,3692
366,Twitter,2024-11-22,https://example.com/post/366/77704078,Post by Rahul Kumar on Weight Loss Foods,778468,90902,3246
401,YouTube,2022-09-20,https://example.com/post/401/14384831,Post by Suresh Naidu on Vital Herbs,579991,85394,2570
364,YouTube,2023-05-09,https://example.com/post/364/86380740,Post by Suresh Das on Herbs for Immunity,903148,36826,3124
386,Facebook,2022-11-04,https://example.com/post/386/30534055,Post by Rohit Chopra on Proteins,930165,85747,734
332,Twitter,2025-04-17,https://example.com/post/332/68808057,Post by Divya Mehta on Weight Loss Foods,933465,37542,527
239,Facebook,2024-01-15,https://example.com/post/239/35276371,Post by Priya Malhotra on Pre/Post Workout,40363,39646,1702
431,YouTube,2024-05-07,https://example.com/post/431/17844402,Post by Amit Kapoor on Multivitamins,163703,29984,4395
407,Twitter,2024-08-13,https://example.com/post/407/16299062,Post by Sneha Singh on Multivitamins,172305,21281,4580
313,Twitter,2024-02-19,https://example.com/post/313/66656565,Post by Amit Joshi on Speciality Supplements,410829,44396,1484
230,Instagram,2024-06-13,https://example.com/post/230/31405453,Post by Shweta Reddy on Fat Burners,209635,26400,1093
267,Twitter,2023-06-03,https://example.com/post/267/93699313,Post by Divya Malhotra on Pre/Post Workout,832738,30691,76
70,Facebook,2022-08-27,https://example.com/post/70/28044506,Post by Vikram Patel on Vital Herbs,347228,52645,4699
56,Facebook,2023-10-09,https://example.com/post/56/37435603,Post by Manish Nair on Proteins,921455,1355,1881
12,Facebook,2023-10-17,https://example.com/post/12/36476938,Post by Karan Nair on Gainers,266959,53565,3837
226,YouTube,2022-12-10,https://example.com/post/226/26489417,Post by Anita Chatterjee on Herbs for Personal Care,703889,56119,3737
187,Twitter,2022-08-15,https://example.com/post/187/68725569,Post by Vikram Patel on Fat Burners,898479,56000,1163
398,Facebook,2025-03-30,https://example.com/post/398/91828859,Post by Aditya Chatterjee on Multivitamins,640590,45580,2582
128,Instagram,2022-11-18,https://example.com/post/128/33294933,Post by Priya Das on Herbs for Immunity,292497,84166,3032
108,Twitter,2022-11-16,https://example.com/post/108/20501450,Post by Manish Menon on Weight Loss Foods,988299,22730,1890
377,Facebook,2024-01-05,https://example.com/post/377/75449429,Post by Anita Chopra on Fat Burners,179915,30850,237
111,Twitter,2024-01-30,https://example.com/post/111/27691237,Post by Shweta Singh on Speciality Supplements,49933,16703,4425
152,YouTube,2025-02-17,https://example.com/post/152/19140411,Post by Ravi Nair on Vital Herbs,993527,76271,134
47,Facebook,2025-02-09,https://example.com/post/47/31883430,Post by Rohit Kumar on Vital Herbs,172344,86808,1084
150,Facebook,2022-11-08,https://example.com/post/150/60103462,Post by Divya Nair on Vital Herbs,62330,57636,3388
470,Facebook,2024-01-06,https://example.com/post/470/98658036,Post by Sneha Malhotra on Fat Burners,926995,71676,3789
374,Instagram,2023-02-18,https://example.com/post/374/73926166,Post by Ravi Sharma on Herbs for Personal Care,674388,83419,4056
165,Facebook,2024-01-09,https://example.com/post/165/65555398,Post by Sanya Joshi on Vital Herbs,112013,81615,4921
480,Facebook,2023-08-03,https://example.com/post/480/45394511,Post by Sneha Sharma on Speciality Supplements,53477,50685,2947
328,Twitter,2023-11-02,https://example.com/post/328/82051154,Post by Sneha Malhotra on Speciality Supplements,915774,57814,1262
404,Twitter,2025-03-11,https://example.com/post/404/94412523,Post by Rahul Nair on Vital Herbs,156543,44546,4143
447,Facebook,2022-12-03,https://example.com/post/447/34142912,Post by Aditya Kapoor on Gainers,164107,41554,4905
21,YouTube,2024-06-26,https://example.com/post/21/61711055,Post by Isha Naidu on Herbs for Immunity,414351,99435,4372
145,Twitter,2023-12-28,https://example.com/post/145/78066270,Post by Manish Patel on Pre/Post Workout,760910,96977,1207
485,Twitter,2023-12-13,https://example.com/post/485/75158383,Post by Amit Kumar on Multivitamins,262204,82258,1537
232,Facebook,2022-12-28,https://example.com/post/232/35005684,Post by Sanya Sharma on Multivitamins,105574,17088,692
45,Instagram,2022-10-29,https://example.com/post/45/26002217,Post by Sneha Joshi on Gainers,557705,60066,4206
22,Facebook,2023-11-19,https://example.com/post/22/56527328,Post by Manish Menon on Speciality Supplements,722797,72506,3407
414,Twitter,2022-11-04,https://example.com/post/414/99873483,Post by Manish Reddy on Gainers,961842,9740,3722
438,Facebook,2022-11-03,https://example.com/post/438/75059528,Post by Suresh Patel on Fat Burners,306500,90959,295
409,YouTube,2023-10-29,https://example.com/post/409/90297666,Post by Anita Iyer on Herbs for Immunity,159388,46255,848
301,YouTube,2023-12-22,https://example.com/post/301/57641877,Post by Divya Gupta on Gainers,187859,78454,2607
377,Facebook,2023-03-06,https://example.com/post/377/76302450,Post by Anita Chopra on Fat Burners,107979,22681,1437
73,Twitter,2025-04-28,https://example.com/post/73/62051034,Post by Pooja Naidu on Multivitamins,785794,33411,2046
113,Facebook,2025-02-09,https://example.com/post/113/34399159,Post by Suresh Singh on Weight Loss Foods,172494,2863,2954
439,Twitter,2024-03-08,https://example.com/post/439/30086155,Post by Rahul Menon on Herbs for Personal Care,152353,14859,3077
91,Twitter,2024-09-03,https://example.com/post/91/53017146,Post by Amit Singh on Fat Burners,719378,34216,4842
451,Instagram,2024-09-15,https://example.com/post/451/35817805,Post by Karan Mehta on Herbs for Immunity,953916,25648,12
355,Twitter,2023-08-29,https://example.com/post/355/37159852,Post by Vikram Verma on Pre/Post Workout,304978,38641,2474
227,Twitter,2022-08-31,https://example.com/post/227/50900605,Post by Isha Bhartia on Proteins,527598,68019,4088
261,YouTube,2024-06-01,https://example.com/post/261/11576195,Post by Rahul Reddy on Proteins,285124,60949,170
412,YouTube,2023-06-30,https://example.com/post/412/11385716,Post by Anjali Malhotra on Pre/Post Workout,902965,49095,3092
393,Facebook,2025-05-29,https://example.com/post/393/56890422,Post by Vikram Naidu on Herbs for Personal Care,75838,80276,2565
98,Instagram,2025-01-27,https://example.com/post/98/76684091,Post by Vikram Chatterjee on Herbs for Immunity,270881,81827,1488
204,YouTube,2024-12-15,https://example.com/post/204/95182735,Post by Shweta Das on Vital Herbs,690892,27470,1310
486,Facebook,2024-05-03,https://example.com/post/486/65581553,Post by Aditya Singh on Fat Burners,245497,35178,1515
232,Facebook,2025-05-09,https://example.com/post/232/73641389,Post by Sanya Sharma on Multivitamins,335397,22397,1310
467,Instagram,2024-07-28,https://example.com/post/467/86133493,Post by Pooja Patel on Speciality Supplements,162072,2348,3427
42,Twitter,2024-10-19,https://example.com/post/42/56880867,Post by Neha Nair on Speciality Supplements,570100,11022,1161
415,Facebook,2023-04-25,https://example.com/post/415/13728160,Post by Shweta Singh on Herbs for Immunity,686894,48400,4691
372,Instagram,2023-06-12,https://example.com/post/372/30254713,Post by Priya Verma on Multivitamins,622311,37515,958
37,Twitter,2024-05-15,https://example.com/post/37/65098084,Post by Shweta Sharma on Pre/Post Workout,229973,5560,1242
303,Instagram,2024-05-05,https://example.com/post/303/52386580,Post by Anita Malhotra on Multivitamins,795244,87191,4764
206,Instagram,2023-11-13,https://example.com/post/206/68504386,Post by Ravi Kumar on Gainers,257233,60772,1262
331,Facebook,2024-11-07,https://example.com/post/331/33133830,Post by Manish Joshi on Herbs for Personal Care,867824,81632,2430
341,Instagram,2023-07-28,https://example.com/post/341/15737190,Post by Sanya Patel on Weight Loss Foods,453423,49461,622
172,YouTube,2024-01-06,https://example.com/post/172/93685072,Post by Neha Nair on Proteins,540358,3597,4515
174,Instagram,2023-02-08,https://example.com/post/174/36109610,Post by Deepak Sharma on Proteins,215709,94926,876
115,Twitter,2022-10-15,https://example.com/post/115/15853153,Post by Priya Singh on Gainers,286853,75271,4378
437,Twitter,2023-10-27,https://example.com/post/437/31076736,Post by Rohit Iyer on Herbs for Personal Care,68352,84246,685
91,Twitter,2023-05-31,https://example.com/post/91/22664947,Post by Amit Singh on Fat Burners,996892,22711,624
191,Facebook,2024-03-22,https://example.com/post/191/78633818,Post by Sanya Joshi on Herbs for Personal Care,695939,14815,3051
276,Instagram,2023-06-04,https://example.com/post/276/68443796,Post by Vikram Patel on Pre/Post Workout,570838,54727,4389
256,YouTube,2024-10-24,https://example.com/post/256/49990742,Post by Rohit Joshi on Herbs for Immunity,938038,1155,851
391,YouTube,2023-03-06,https://example.com/post/391/81247910,Post by Priya Sharma on Speciality Supplements,343587,34409,4556
276,Instagram,2022-11-21,https://example.com/post/276/62272894,Post by Vikram Patel on Pre/Post Workout,325328,40104,1094
429,YouTube,2022-07-26,https://example.com/post/429/15715022,Post by Shweta Chopra on Vital Herbs,834211,50940,1455
292,YouTube,2025-05-19,https://example.com/post/292/76817345,Post by Priya Kumar on Fat Burners,464726,83710,4296
246,Twitter,2023-12-07,https://example.com/post/246/52101199,Post by Deepak Chopra on Gainers,547078,42948,3176
327,Facebook,2024-10-24,https://example.com/post/327/47818391,Post by Anita Gupta on Proteins,992671,52386,2546
397,Instagram,2023-03-25,https://example.com/post/397/89966028,Post by Anjali Naidu on Proteins,457491,94975,1059
112,YouTube,2024-03-22,https://example.com/post/112/98382911,Post by Karan Verma on Herbs for Immunity,190050,14702,1154
